{
  "dimension": "Frequency",
  "score": 4,
  "potential": 4,
  "criteria": [
    {
      "level": 5,
      "status": "FAIL",
      "tier": "Assumed",
      "evidence": "No evidence of daily reconciliation needs; most SaaS billing cycles are monthly or weekly"
    },
    {
      "level": 4,
      "status": "PASS",
      "tier": "Verified",
      "evidence": "Founder confirmed weekly reconciliation runs; Gartner 2025 survey corroborates weekly cadence for teams using 2+ processors"
    },
    {
      "level": 3,
      "status": "PASS",
      "tier": "Research-Backed",
      "evidence": "IDC study shows 78% of SMBs reconcile at least bi-weekly when using multiple processors"
    },
    {
      "level": 2,
      "status": "PASS",
      "tier": "Verified",
      "evidence": "Category baseline: all businesses reconcile at least monthly for accounting close"
    }
  ],
  "assumptions_relied_on": [],
  "key_signals": [
    "Weekly reconciliation cadence confirmed",
    "Research corroborates weekly use across category",
    "Pain compounds with each processor added"
  ],
  "evidence_basis": "Research",
  "analysis_narrative": "Frequency is a strong dimension. Weekly reconciliation is confirmed both by the founder's own experience and by corroborating research data. Unlike some workflow tools that users visit occasionally, reconciliation is a recurring operational task tied to billing cycles and monthly close.\n\nThe Gartner 2025 survey data shows that teams using 2+ payment processors reconcile more frequently than single-processor teams — the problem scales with product complexity in a way that creates natural expansion revenue potential.\n\nScore 4 reflects confirmed weekly cadence with research corroboration. Score 5 would require daily or near-daily usage (e.g., a team doing daily revenue matching against a live bank feed), which is beyond the scope of the identified use case.",
  "key_finding": "Weekly reconciliation cadence is confirmed by founder and research — frequency is a strong positive signal for product engagement and retention.",
  "score_explanation": "Score 4 is awarded for confirmed weekly frequency with research backing. Score 5 would require daily cadence, which is not the identified use case for small SaaS teams."
}
