{
  "dimension": "Solution Gap",
  "score": 4,
  "potential": 4,
  "criteria": [
    {
      "level": 5,
      "status": "FAIL",
      "tier": "Research-Backed",
      "evidence": "Research found no tool that fully automates multi-processor CSV reconciliation end-to-end including bank statement matching"
    },
    {
      "level": 4,
      "status": "PASS",
      "tier": "Research-Backed",
      "evidence": "Ramp and Brex handle card spend but lack custom CSV ingest; QuickBooks requires manual mapping; no multi-processor automated matching tool found"
    },
    {
      "level": 3,
      "status": "PASS",
      "tier": "Research-Backed",
      "evidence": "Category sweep confirmed no product directly addresses the Stripe + PayPal + bank CSV triangulation use case for small SaaS teams"
    }
  ],
  "assumptions_relied_on": [],
  "key_signals": [
    "No incumbent handles multi-processor CSV reconciliation end-to-end",
    "Ramp/Brex: card-centric, no CSV ingest",
    "QuickBooks: manual mapping, not automated matching"
  ],
  "evidence_basis": "Research",
  "analysis_narrative": "The competitive landscape research reveals a genuine gap. The incumbents in finance tooling (Ramp, Brex, QuickBooks, Xero) are each optimized for a narrower problem than multi-processor automated reconciliation. Ramp and Brex are card-spend management tools that happen to have reconciliation features; they don't ingest external processor CSVs. QuickBooks handles bookkeeping but requires manual bank rule creation rather than automated cross-source matching.\n\nDedicated reconciliation tools like Docyt and Veryfi focus on receipt capture and expense management — a different workflow. The specific triangulation problem (Stripe exports + PayPal reports + bank statement = one coherent ledger) appears to be unaddressed by existing SaaS at the SMB price point.\n\nThe gap is real but not impenetrable. Score 4 rather than 5 reflects that a determined incumbent (e.g., QuickBooks) could close this gap with a feature release, and the barrier to entry for a new entrant is technical but not structural.",
  "key_finding": "No existing tool handles multi-processor CSV reconciliation end-to-end for small SaaS teams — the specific triangulation use case is an unaddressed gap.",
  "score_explanation": "Score 4 reflects a clearly validated competitive gap confirmed through research. Score 5 would require the gap to be structural or protected by network effects; here the gap is real but could be closed by an incumbent feature update."
}
